"","text","favorited","favoriteCount","replyToSN","created","truncated","replyToSID","id","replyToUID","statusSource","screenName","retweetCount","isRetweet","retweeted","longitude","latitude"
"1","I ask my colleagues and everyone in the Capitol community to keep Matthew’s loved ones in your thoughts. 3/3",FALSE,415,"SpeakerRyan",2017-04-18 18:08:14,FALSE,"854395028751384578","854396165068124160","18916432","<a href=""http://twitter.com"" rel=""nofollow"">Twitter Web Client</a>","SpeakerRyan",85,FALSE,FALSE,NA,NA
"2","Matthew and his wife, Lauren, have two young children, Evie and Matthew. Their loss is so sudden and unimaginable. 2/3",FALSE,300,"SpeakerRyan",2017-04-18 18:03:43,FALSE,"854394166377418753","854395028751384578","18916432","<a href=""http://twitter.com"" rel=""nofollow"">Twitter Web Client</a>","SpeakerRyan",73,FALSE,FALSE,NA,NA
"3","This morning, a tragic accident on Capitol grounds took the life of Matthew McClanahan, a pipefitter for the Architect of the Capitol. 1/3",FALSE,424,NA,2017-04-18 18:00:17,FALSE,NA,"854394166377418753",NA,"<a href=""http://twitter.com"" rel=""nofollow"">Twitter Web Client</a>","SpeakerRyan",158,FALSE,FALSE,NA,NA
"4","We must make the tax code—and Tax Day itself—simpler for all Americans. https://t.co/QbNmD5HBPH",FALSE,1658,NA,2017-04-18 12:45:15,FALSE,NA,"854314882631700481",NA,"<a href=""https://studio.twitter.com"" rel=""nofollow"">Media Studio</a>","SpeakerRyan",394,FALSE,FALSE,NA,NA
"5","To fix the #VA, we need to change the culture. Hold bureaucrats accountable. Hire the right people.",FALSE,621,"SpeakerRyan",2017-04-17 21:16:00,FALSE,"852514414733520896","854081029237329921","18916432","<a href=""http://twitter.com"" rel=""nofollow"">Twitter Web Client</a>","SpeakerRyan",97,FALSE,FALSE,NA,NA
"6","On Easter Sunday, we are reminded that one of the most important messages Christianity has brought the world is one… https://t.co/Ee275UaBrt",FALSE,2738,NA,2017-04-17 00:41:21,TRUE,NA,"853770322939654144",NA,"<a href=""https://studio.twitter.com"" rel=""nofollow"">Media Studio</a>","SpeakerRyan",469,FALSE,FALSE,NA,NA
"7","Diverse though we may be, Christians around the world are united in our shared belief that Jesus rose from the dead. https://t.co/Ve6AvaqFpG",FALSE,2721,NA,2017-04-16 18:12:21,FALSE,NA,"853672426386927616",NA,"<a href=""http://twitter.com"" rel=""nofollow"">Twitter Web Client</a>","SpeakerRyan",396,FALSE,FALSE,NA,NA
"8","Today, I wish you and your loved ones a blessed Easter. https://t.co/AeQy6PfQS8",FALSE,3839,NA,2017-04-16 12:43:04,FALSE,NA,"853589558738509824",NA,"<a href=""https://studio.twitter.com"" rel=""nofollow"">Media Studio</a>","SpeakerRyan",486,FALSE,FALSE,NA,NA
"9","Wishing our Sikh American neighbors and friends a happy #Vaisakhi!",FALSE,903,NA,2017-04-14 20:57:51,FALSE,NA,"852989298655801348",NA,"<a href=""http://twitter.com/download/iphone"" rel=""nofollow"">Twitter for iPhone</a>","SpeakerRyan",188,FALSE,FALSE,NA,NA
"10","On #GoodFriday, we pause to remember and pray for all those around the world persecuted because of their Christian faith.",FALSE,5703,NA,2017-04-14 15:15:00,FALSE,NA,"852903019431776256",NA,"<a href=""http://twitter.com"" rel=""nofollow"">Twitter Web Client</a>","SpeakerRyan",1389,FALSE,FALSE,NA,NA
"11","Wisconsin is a great place to call home for families and businesses alike. https://t.co/OF3Hcyif28",FALSE,378,NA,2017-04-14 13:22:00,FALSE,NA,"852874583271190529",NA,"<a href=""http://twitter.com"" rel=""nofollow"">Twitter Web Client</a>","SpeakerRyan",54,FALSE,FALSE,NA,NA
"12","This is a major pro-life victory. Another Congressional Review Act bill is now law. https://t.co/1vAjJjcu3B",FALSE,2824,NA,2017-04-13 16:15:27,FALSE,NA,"852555841563754496",NA,"<a href=""https://about.twitter.com/products/tweetdeck"" rel=""nofollow"">TweetDeck</a>","SpeakerRyan",864,FALSE,FALSE,NA,NA
"13","We believe in a patient-centered health care system. That means greater choice and more competition. https://t.co/YssYAU2ahN",FALSE,480,NA,2017-04-13 15:58:55,FALSE,NA,"852551681887924225",NA,"<a href=""http://twitter.com"" rel=""nofollow"">Twitter Web Client</a>","SpeakerRyan",80,FALSE,FALSE,NA,NA
"14","Here is how Congress is making good on President Trump’s commitment to take care of our #veterans <U+2192> https://t.co/MDjVqdJIE1",FALSE,1255,NA,2017-04-13 13:30:50,FALSE,NA,"852514414733520896",NA,"<a href=""http://twitter.com"" rel=""nofollow"">Twitter Web Client</a>","SpeakerRyan",275,FALSE,FALSE,NA,NA
"15","Tax reform will usher in a new era of economic growth in our country. https://t.co/CCsjSFrT2u",FALSE,1003,NA,2017-04-12 23:05:02,FALSE,NA,"852296532074393600",NA,"<a href=""http://twitter.com/download/iphone"" rel=""nofollow"">Twitter for iPhone</a>","SpeakerRyan",167,FALSE,FALSE,NA,NA
"16","The GOP tax plan will create 1.7 million new jobs and raise average household incomes by $4,917/year.
https://t.co/pu9LQjomt0",FALSE,1082,NA,2017-04-12 20:03:02,FALSE,NA,"852250730077585412",NA,"<a href=""http://twitter.com/download/iphone"" rel=""nofollow"">Twitter for iPhone</a>","SpeakerRyan",272,FALSE,FALSE,NA,NA
"17","Dedicated to our men &amp; women in uniform, thousands of service dogs give back to those who ensure our safety abroad.… https://t.co/yfuWXlyOaX",FALSE,604,NA,2017-04-12 18:05:50,TRUE,NA,"852221235903832066",NA,"<a href=""http://twitter.com"" rel=""nofollow"">Twitter Web Client</a>","SpeakerRyan",102,FALSE,FALSE,NA,NA
"18","I had the pleasure of visiting members and students preparing for Passover at @JCCMilwaukee. https://t.co/ABGgB1HlCa https://t.co/Bb9tz914c8",FALSE,382,NA,2017-04-12 17:07:14,FALSE,NA,"852206485404880896",NA,"<a href=""http://twitter.com"" rel=""nofollow"">Twitter Web Client</a>","SpeakerRyan",53,FALSE,FALSE,NA,NA
"19","Next week, I'm leading a bipartisan delegation to visit key European ally nations. https://t.co/OJ30fNCvSU",FALSE,440,NA,2017-04-12 15:17:00,FALSE,NA,"852178747616874498",NA,"<a href=""http://twitter.com"" rel=""nofollow"">Twitter Web Client</a>","SpeakerRyan",88,FALSE,FALSE,NA,NA
"20","See how the GOP tax plan will grow jobs in your state: https://t.co/pu9LQjomt0 https://t.co/TdXzVAIWJQ",FALSE,587,NA,2017-04-12 13:15:28,FALSE,NA,"852148162848600064",NA,"<a href=""http://twitter.com"" rel=""nofollow"">Twitter Web Client</a>","SpeakerRyan",203,FALSE,FALSE,NA,NA
"21","As one veteran described his life alongside his service dog, it is like ""life by 1,000 hugs."" https://t.co/VYaTctD48b #NationalPetDay",FALSE,959,NA,2017-04-12 00:39:48,FALSE,NA,"851957989670100993",NA,"<a href=""http://twitter.com/download/iphone"" rel=""nofollow"">Twitter for iPhone</a>","SpeakerRyan",167,FALSE,FALSE,NA,NA
"22","Thank you for having me. The work you do in our community is so vitally important. Chag Sameach! https://t.co/KPN2uKK02o",FALSE,319,NA,2017-04-11 23:31:01,FALSE,NA,"851940680092065792",NA,"<a href=""http://twitter.com/download/iphone"" rel=""nofollow"">Twitter for iPhone</a>","SpeakerRyan",43,FALSE,FALSE,NA,NA
"23","#NationalPetDay is the perfect day to recognize the thousands of service dogs that help America’s disabled veterans… https://t.co/aHfEXxP43m",FALSE,1129,NA,2017-04-11 18:19:38,TRUE,NA,"851862317969047552",NA,"<a href=""http://twitter.com"" rel=""nofollow"">Twitter Web Client</a>","SpeakerRyan",247,FALSE,FALSE,NA,NA
"24","Passover is a story of hope—a reminder to never forget your roots, and to always look towards the future.… https://t.co/fuk6tBZme4",FALSE,1142,NA,2017-04-11 16:23:40,TRUE,NA,"851833136002588673",NA,"<a href=""https://studio.twitter.com"" rel=""nofollow"">Media Studio</a>","SpeakerRyan",246,FALSE,FALSE,NA,NA
"25","More of the same bureaucracy and spending from Washington is NOT the way to promote opportunity. https://t.co/he3uHZO6j8",FALSE,453,NA,2017-04-11 13:35:17,FALSE,NA,"851790759221186560",NA,"<a href=""http://twitter.com"" rel=""nofollow"">Twitter Web Client</a>","SpeakerRyan",114,FALSE,FALSE,NA,NA
"26","Wishing all who celebrate a joyous and Happy Passover. https://t.co/SaIVLrgUqw https://t.co/jEuRaOWdLk",FALSE,1537,NA,2017-04-10 20:54:07,FALSE,NA,"851538809351286789",NA,"<a href=""https://studio.twitter.com"" rel=""nofollow"">Media Studio</a>","SpeakerRyan",263,FALSE,FALSE,NA,NA
"27","Justice Scalia’s seat will now be filled by a judge committed to our Constitution and first principles. Welcome to… https://t.co/70XiQGMuXQ",FALSE,3220,NA,2017-04-10 15:15:53,TRUE,NA,"851453688690483200",NA,"<a href=""https://studio.twitter.com"" rel=""nofollow"">Media Studio</a>","SpeakerRyan",527,FALSE,FALSE,NA,NA
"28","Praying for victims of the heinous attack on Coptic Christians celebrating #PalmSunday in Egypt. ISIS must be defeated.",FALSE,4075,NA,2017-04-10 00:25:18,FALSE,NA,"851229566358233088",NA,"<a href=""http://twitter.com"" rel=""nofollow"">Twitter Web Client</a>","SpeakerRyan",828,FALSE,FALSE,NA,NA
"29","With more choices, there’s more competition. With more competition, lower prices. We must bring these principles to… https://t.co/UCoJvU3NeC",FALSE,1824,NA,2017-04-09 21:18:17,TRUE,NA,"851182501792026624",NA,"<a href=""https://studio.twitter.com"" rel=""nofollow"">Media Studio</a>","SpeakerRyan",361,FALSE,FALSE,NA,NA
"30","Congress acted to preserve the #Veterans Choice Program, which helps vets access quality health care close to home.… https://t.co/KOTic0t1Oo",FALSE,1546,NA,2017-04-09 17:08:37,TRUE,NA,"851119670778351616",NA,"<a href=""http://twitter.com"" rel=""nofollow"">Twitter Web Client</a>","SpeakerRyan",330,FALSE,FALSE,NA,NA
"31","Justice Neil Gorsuch is a thoughtful jurist who has the utmost respect for the rule of law. https://t.co/LPuCwZLNFi",FALSE,2734,NA,2017-04-08 22:36:29,FALSE,NA,"850839793755979777",NA,"<a href=""http://twitter.com/download/iphone"" rel=""nofollow"">Twitter for iPhone</a>","SpeakerRyan",386,FALSE,FALSE,NA,NA
"32","We must #repealANDreplace #Obamacare to ensure that Americans have a choice when it comes to their health care.",FALSE,478,"SpeakerRyan",2017-04-08 20:39:08,FALSE,"850782676428763141","850810261095186432","18916432","<a href=""http://twitter.com/download/iphone"" rel=""nofollow"">Twitter for iPhone</a>","SpeakerRyan",101,FALSE,FALSE,NA,NA
"33","Five Iowa counties will now be left with just two health insurers, while the rest will only have one option. This is unacceptable.",FALSE,672,"SpeakerRyan",2017-04-08 18:49:31,FALSE,"850721655748001792","850782676428763141","18916432","<a href=""http://twitter.com/download/iphone"" rel=""nofollow"">Twitter for iPhone</a>","SpeakerRyan",202,FALSE,FALSE,NA,NA
"34","With another insurer leaving the Iowa insurance market, more Americans will be left without a choice when it comes… https://t.co/a5qYcU36tt",FALSE,1183,NA,2017-04-08 14:47:03,TRUE,NA,"850721655748001792",NA,"<a href=""http://twitter.com"" rel=""nofollow"">Twitter Web Client</a>","SpeakerRyan",515,FALSE,FALSE,NA,NA
"35","Congratulations, Judge Gorsuch, on your confirmation as Associate Justice of the United States Supreme Court. https://t.co/YY5efAxMHq",FALSE,5679,NA,2017-04-07 16:00:53,FALSE,NA,"850377851920674817",NA,"<a href=""https://studio.twitter.com"" rel=""nofollow"">Media Studio</a>","SpeakerRyan",1024,FALSE,FALSE,NA,NA
"36","This action in Syria was appropriate and just.

My full statement: https://t.co/oIlOT65zTC",FALSE,6037,NA,2017-04-07 02:36:08,FALSE,NA,"850175327582265345",NA,"<a href=""http://twitter.com"" rel=""nofollow"">Twitter Web Client</a>","SpeakerRyan",2165,FALSE,FALSE,NA,NA
"37","Congress has now sent the @WhiteHouse 13 Congressional Review Acts, furthering our efforts to reverse Obama-era ove… https://t.co/WuTK0dlpXa",FALSE,773,NA,2017-04-06 19:43:07,TRUE,NA,"850071390220931073",NA,"<a href=""https://studio.twitter.com"" rel=""nofollow"">Media Studio</a>","SpeakerRyan",191,FALSE,FALSE,NA,NA
"38","This promise to improve health care is too important and the consequences are too dire for American families. https://t.co/QHOC6IVTRU",FALSE,618,NA,2017-04-06 17:29:26,FALSE,NA,"850037748929114112",NA,"<a href=""http://twitter.com"" rel=""nofollow"">Twitter Web Client</a>","SpeakerRyan",99,FALSE,FALSE,NA,NA
"39","Insurers are leaving #Obamacare left and right, leaving many people with only one option. That's not a choice. That… https://t.co/lBq2FBSaFa",FALSE,889,NA,2017-04-06 16:37:26,TRUE,NA,"850024660985012225",NA,"<a href=""http://snappytv.com"" rel=""nofollow"">SnappyTV.com</a>","SpeakerRyan",217,FALSE,FALSE,NA,NA
"40","This has been a productive week in the House as we continue our efforts to #repealANDreplace #Obamacare. https://t.co/QHOC6IVTRU",FALSE,336,NA,2017-04-06 14:58:38,FALSE,NA,"849999797381738497",NA,"<a href=""http://twitter.com"" rel=""nofollow"">Twitter Web Client</a>","SpeakerRyan",68,FALSE,FALSE,NA,NA
"41","We have made real progress in our efforts to #RepealAndReplace Obamacare. https://t.co/tw1NbzARn3",FALSE,744,NA,2017-04-06 13:56:38,FALSE,NA,"849984193975037953",NA,"<a href=""http://snappytv.com"" rel=""nofollow"">SnappyTV.com</a>","SpeakerRyan",152,FALSE,FALSE,NA,NA
"42","LIVE <U+2192> my weekly press conference. https://t.co/pb3gSTI2ic",FALSE,116,NA,2017-04-06 13:51:40,FALSE,NA,"849982942256521217",NA,"<a href=""http://twitter.com"" rel=""nofollow"">Twitter Web Client</a>","SpeakerRyan",23,FALSE,FALSE,NA,NA
"43","My statement on Chairman Nunes: https://t.co/0ZEtdeQ39Z https://t.co/8m8BOCDs0G",FALSE,534,NA,2017-04-06 13:46:30,FALSE,NA,"849981643095977992",NA,"<a href=""https://about.twitter.com/products/tweetdeck"" rel=""nofollow"">TweetDeck</a>","SpeakerRyan",375,FALSE,FALSE,NA,NA
"44","Tune in live at 9:45am ET for my weekly press conference <U+2B07> https://t.co/RrNzrxPmYU",FALSE,188,NA,2017-04-06 13:01:53,FALSE,NA,"849970414835175425",NA,"<a href=""http://twitter.com"" rel=""nofollow"">Twitter Web Client</a>","SpeakerRyan",32,FALSE,FALSE,NA,NA
"45","GREAT NEWS <U+2192> This bipartisan legislation just passed the House by a vote of 400 to 16. https://t.co/BLHsLc0LvZ",FALSE,773,NA,2017-04-05 21:35:43,FALSE,NA,"849737338662027269",NA,"<a href=""http://twitter.com"" rel=""nofollow"">Twitter Web Client</a>","SpeakerRyan",198,FALSE,FALSE,NA,NA
"46","Now headed to @WhiteHouse <U+2192> Repeal of Obama-era rule that left working families w/ fewer protections &amp; less control… https://t.co/3gaesz5Je0",FALSE,681,NA,2017-04-05 19:16:00,TRUE,NA,"849702178268880897",NA,"<a href=""http://twitter.com"" rel=""nofollow"">Twitter Web Client</a>","SpeakerRyan",156,FALSE,FALSE,NA,NA
"47","Brandon is such a special young man and his work to raise awareness for muscular dystrophy is an inspiration. https://t.co/IgSn1RORQb",FALSE,658,NA,2017-04-05 18:23:36,FALSE,NA,"849688991125340160",NA,"<a href=""http://twitter.com"" rel=""nofollow"">Twitter Web Client</a>","SpeakerRyan",108,FALSE,FALSE,NA,NA
"48","We want to create a 21st century infrastructure system that's a good foundation for solid economic growth. https://t.co/8aJPYdoeWm",FALSE,627,NA,2017-04-05 17:14:27,FALSE,NA,"849671587603206144",NA,"<a href=""http://snappytv.com"" rel=""nofollow"">SnappyTV.com</a>","SpeakerRyan",102,FALSE,FALSE,NA,NA
"49","We need to stand up to Russia and help our allies stand up to Russia. https://t.co/3jZrgecHkJ",FALSE,566,NA,2017-04-05 17:04:44,FALSE,NA,"849669141472583680",NA,"<a href=""http://snappytv.com"" rel=""nofollow"">SnappyTV.com</a>","SpeakerRyan",98,FALSE,FALSE,NA,NA
"50","There is no justification for the events that occurred in Syria. https://t.co/hkKt97TQWB",FALSE,721,NA,2017-04-05 16:55:32,FALSE,NA,"849666827340795904",NA,"<a href=""http://snappytv.com"" rel=""nofollow"">SnappyTV.com</a>","SpeakerRyan",129,FALSE,FALSE,NA,NA
"51","I'll be participating is a Q&amp;A with @wispolitics at 12:30pm ET. Watch live <U+2B07><U+FE0F> https://t.co/RrNzrxPmYU",FALSE,172,NA,2017-04-05 16:17:44,FALSE,NA,"849657316714721281",NA,"<a href=""http://twitter.com"" rel=""nofollow"">Twitter Web Client</a>","SpeakerRyan",37,FALSE,FALSE,NA,NA
"52","The Obama administration’s last regulatory onslaught may have been its most extreme. We are reversing it.… https://t.co/wDkhxBcVND",FALSE,1169,NA,2017-04-05 14:06:41,TRUE,NA,"849624334331138050",NA,"<a href=""http://snappytv.com"" rel=""nofollow"">SnappyTV.com</a>","SpeakerRyan",271,FALSE,FALSE,NA,NA
"53","We're overturning an Obama-era regulation that tried to force states to give Title X funding to abortion providers… https://t.co/4TFkQ3CVgZ",FALSE,1995,NA,2017-04-04 21:09:09,TRUE,NA,"849368264249626624",NA,"<a href=""http://twitter.com"" rel=""nofollow"">Twitter Web Client</a>","SpeakerRyan",401,FALSE,FALSE,NA,NA
"54","The strategic US-Egypt partnership is essential to securing regional stability and defeating terrorism.… https://t.co/r2yy0aXy9Y",FALSE,625,NA,2017-04-04 19:15:10,TRUE,NA,"849339578322481152",NA,"<a href=""http://twitter.com"" rel=""nofollow"">Twitter Web Client</a>","SpeakerRyan",232,FALSE,FALSE,NA,NA
"55","No words can capture the depth of this horror. We join the Trump administration in condemning this barbaric attack… https://t.co/KqU3nZkmsc",FALSE,884,NA,2017-04-04 18:20:01,TRUE,NA,"849325701631225857",NA,"<a href=""http://twitter.com"" rel=""nofollow"">Twitter Web Client</a>","SpeakerRyan",237,FALSE,FALSE,NA,NA
"56","Another insurer is leaving #Obamacare. Now more than ever, you deserve a system that offers more choice, more compe… https://t.co/ddicbInfoS",FALSE,833,NA,2017-04-04 17:50:52,TRUE,NA,"849318364266864640",NA,"<a href=""http://twitter.com"" rel=""nofollow"">Twitter Web Client</a>","SpeakerRyan",267,FALSE,FALSE,NA,NA
"57","Congress is returning power from unelected bureaucrats in Washington to the states &amp; people that we represent. https://t.co/rO9GU95wfz",FALSE,755,NA,2017-04-04 16:07:32,FALSE,NA,"849292359451934721",NA,"<a href=""http://twitter.com"" rel=""nofollow"">Twitter Web Client</a>","SpeakerRyan",150,FALSE,FALSE,NA,NA
"58","After years of talk about cutting red tape, it is now actually happening. We are protecting jobs and saving taxpaye… https://t.co/yL2XkncpvQ",FALSE,1459,NA,2017-04-04 13:57:24,TRUE,NA,"849259612133916674",NA,"<a href=""http://snappytv.com"" rel=""nofollow"">SnappyTV.com</a>","SpeakerRyan",234,FALSE,FALSE,NA,NA
"59","Starting at 10am ET: @HouseGOP News Conference to talk about specific steps we're taking to grow America's economy<U+2192> https://t.co/RrNzrxPmYU",FALSE,345,NA,2017-04-04 13:46:49,FALSE,NA,"849256947551539200",NA,"<a href=""http://twitter.com/download/iphone"" rel=""nofollow"">Twitter for iPhone</a>","SpeakerRyan",68,FALSE,FALSE,NA,NA
"60","The Obama administration's policy of strategic patience towards North Korea was a total failure. https://t.co/4GY37vU4Dk",FALSE,1307,NA,2017-04-04 01:12:53,FALSE,NA,"849067212812021761",NA,"<a href=""http://twitter.com"" rel=""nofollow"">Twitter Web Client</a>","SpeakerRyan",281,FALSE,FALSE,NA,NA
"61","Following @POTUS's leadership, we are taking the necessary, concrete actions to hold North Korea accountable. https://t.co/4GY37vU4Dk",FALSE,1222,NA,2017-04-03 20:31:55,FALSE,NA,"848996506308943872",NA,"<a href=""http://twitter.com"" rel=""nofollow"">Twitter Web Client</a>","SpeakerRyan",206,FALSE,FALSE,NA,NA
"62","In a couple of hours, I'll address 18,000 pro-Israel activists from across the country at #AIPAC2017.… https://t.co/2j9xZHKGnp",FALSE,730,NA,2017-03-27 19:06:59,TRUE,NA,"846438419207196672",NA,"<a href=""https://studio.twitter.com"" rel=""nofollow"">Media Studio</a>","SpeakerRyan",163,FALSE,FALSE,NA,NA
"63","Another regulatory power grab from the Obama Administration is getting rolled back. This one reverses a harmful U.S… https://t.co/r0XW6op5Mc",FALSE,1335,NA,2017-03-27 16:50:38,TRUE,NA,"846404105484546048",NA,"<a href=""http://twitter.com"" rel=""nofollow"">Twitter Web Client</a>","SpeakerRyan",471,FALSE,FALSE,NA,NA
"64","A strong relationship with #Israel is vital to our national security and a cornerstone of American leadership. <ed><U+00A0><U+00BC><ed><U+00B7><U+00BA><ed><U+00A0><U+00BC><ed><U+00B7><U+00B8><ed><U+00A0><U+00BC><ed><U+00B7><U+00AE><ed><U+00A0><U+00BC><ed><U+00B7><U+00B1>… https://t.co/VMBGmxI354",FALSE,1591,NA,2017-03-27 14:38:24,TRUE,NA,"846370827788541952",NA,"<a href=""http://twitter.com"" rel=""nofollow"">Twitter Web Client</a>","SpeakerRyan",326,FALSE,FALSE,NA,NA
"65","Back to work with another Congressional Review Act that nullifies confusing regulations from the Obama Dept of Labo… https://t.co/PS8owvVkDl",FALSE,1076,NA,2017-03-27 12:38:53,TRUE,NA,"846340750438752256",NA,"<a href=""http://twitter.com"" rel=""nofollow"">Twitter Web Client</a>","SpeakerRyan",175,FALSE,FALSE,NA,NA
"66","I want to thank @POTUS, @VP, @SecPriceMD, &amp; @HouseGOP members. There remains so much we can do to help improve peop… https://t.co/KIF3gh2VpQ",FALSE,2188,NA,2017-03-24 22:22:08,TRUE,NA,"845400366564937734",NA,"<a href=""https://studio.twitter.com"" rel=""nofollow"">Media Studio</a>","SpeakerRyan",463,FALSE,FALSE,NA,NA
"67","News conference beginning now: https://t.co/efs0CMS1FW",FALSE,232,"SpeakerRyan",2017-03-24 20:12:32,FALSE,"845357968371732482","845367750612668419","18916432","<a href=""http://twitter.com/download/iphone"" rel=""nofollow"">Twitter for iPhone</a>","SpeakerRyan",110,FALSE,FALSE,NA,NA
"68","I'll give an update on health care reform at 4pm <U+2192> ET. https://t.co/DLsJK9h6yr",FALSE,777,NA,2017-03-24 19:33:40,FALSE,NA,"845357968371732482",NA,"<a href=""http://twitter.com"" rel=""nofollow"">Twitter Web Client</a>","SpeakerRyan",510,FALSE,FALSE,NA,NA
"69","The American Health Care Act will level the playing field &amp; put states back in control of their health care markets. https://t.co/AfHa69GwOG",FALSE,722,NA,2017-03-24 16:18:49,FALSE,NA,"845308933707354114",NA,"<a href=""http://twitter.com"" rel=""nofollow"">Twitter Web Client</a>","SpeakerRyan",151,FALSE,FALSE,NA,NA
"70","This is the one real chance @HouseGOP has to #repealANDreplace #Obamacare—breaking our promise is not an option. https://t.co/Y7j4jILkJZ",FALSE,570,NA,2017-03-24 15:11:39,FALSE,NA,"845292029680726016",NA,"<a href=""http://twitter.com"" rel=""nofollow"">Twitter Web Client</a>","SpeakerRyan",140,FALSE,FALSE,NA,NA
"71","GREAT NEWS <U+2192> the #KeystoneXL Pipeline is finally approved. It's about time.",FALSE,2075,NA,2017-03-24 14:08:55,FALSE,NA,"845276241460674560",NA,"<a href=""http://twitter.com"" rel=""nofollow"">Twitter Web Client</a>","SpeakerRyan",359,FALSE,FALSE,NA,NA
"72","The American Health Care Act guts #Obamacare—all its taxes, mandates, and spending. #repealANDreplace https://t.co/BFT6StUTjU",FALSE,936,NA,2017-03-24 12:02:17,FALSE,NA,"845244374468431872",NA,"<a href=""http://twitter.com/download/iphone"" rel=""nofollow"">Twitter for iPhone</a>","SpeakerRyan",218,FALSE,FALSE,NA,NA
"73","For 7 years, we have been promising the American people that we will #RepealAndReplace this broken law. Tomorrow, w… https://t.co/s3MdgZjZ9o",FALSE,1474,NA,2017-03-24 01:14:49,TRUE,NA,"845081434180202496",NA,"<a href=""https://studio.twitter.com"" rel=""nofollow"">Media Studio</a>","SpeakerRyan",400,FALSE,FALSE,NA,NA
"74","Thanks to #Obamacare, there are basically forced insurance monopolies. There are 5 states and a thousand counties w… https://t.co/nlINlJxtx8",FALSE,860,NA,2017-03-23 22:46:53,TRUE,NA,"845044207190446081",NA,"<a href=""https://studio.twitter.com"" rel=""nofollow"">Media Studio</a>","SpeakerRyan",257,FALSE,FALSE,NA,NA
"75","From skyrocketing premiums to insurance monopolies in counties all across America, the #Obamacare experiment simply… https://t.co/GT5M2ZN4Cv",FALSE,1132,NA,2017-03-23 17:07:20,TRUE,NA,"844958755418726401",NA,"<a href=""https://studio.twitter.com"" rel=""nofollow"">Media Studio</a>","SpeakerRyan",385,FALSE,FALSE,NA,NA
"76","This throwback from 2010 is still true:""The status quo is unsustainable. It's got to get fixed. It's bankrupting fa… https://t.co/AawGIawRRO",FALSE,1087,NA,2017-03-23 14:43:00,TRUE,NA,"844922431135502336",NA,"<a href=""https://studio.twitter.com"" rel=""nofollow"">Media Studio</a>","SpeakerRyan",286,FALSE,FALSE,NA,NA
"77","Doing nothing means #Obamacare collapses, premiums continue to skyrocket and good people get hurt. Instead, we will… https://t.co/xkWYVyr8m1",FALSE,943,NA,2017-03-23 11:47:25,TRUE,NA,"844878244092424192",NA,"<a href=""https://studio.twitter.com"" rel=""nofollow"">Media Studio</a>","SpeakerRyan",238,FALSE,FALSE,NA,NA
"78","The House took a huge bipartisan vote today to restore competition—just the start of prong three in our plan to… https://t.co/yzlEl9Q2rk",FALSE,1380,NA,2017-03-23 00:23:43,TRUE,NA,"844706187513880577",NA,"<a href=""http://twitter.com"" rel=""nofollow"">Twitter Web Client</a>","SpeakerRyan",331,FALSE,FALSE,NA,NA
"79","FACT <U+2192> The American Health Care Act would double the amount Americans can contribute to their HSAs. https://t.co/5aVXYXCebh",FALSE,587,NA,2017-03-22 23:15:38,FALSE,NA,"844689053534633984",NA,"<a href=""http://twitter.com/download/iphone"" rel=""nofollow"">Twitter for iPhone</a>","SpeakerRyan",130,FALSE,FALSE,NA,NA
