"","text","favorited","favoriteCount","replyToSN","created","truncated","replyToSID","id","replyToUID","statusSource","screenName","retweetCount","isRetweet","retweeted","longitude","latitude"
"715","Today’s the last day to nominate someone to attend the @WhiteHouse United #StateofWomen Summit in DC: https://t.co/UUnqku3g9j",FALSE,361,NA,2016-05-16 18:26:48,FALSE,NA,"732276127042015232",NA,"<a href=""http://twitter.com"" rel=""nofollow"">Twitter Web Client</a>","SenWarren",136,FALSE,FALSE,NA,NA
"716","Congrats @BridgeStateU graduates! Thanks for letting me celebrate with you today. #bsulife https://t.co/6ryL8rcTq2",FALSE,1338,NA,2016-05-14 16:10:11,FALSE,NA,"731516969451716608",NA,"<a href=""http://twitter.com"" rel=""nofollow"">Twitter Web Client</a>","SenWarren",180,FALSE,FALSE,NA,NA
"717","Read @SenateDems report: From gutting Wall St rfm to attacking women’s health, the GOP marches w/ @realDonaldTrump. https://t.co/B76jtDg2lk",FALSE,856,NA,2016-05-12 19:23:52,FALSE,NA,"730840937497300992",NA,"<a href=""http://twitter.com"" rel=""nofollow"">Twitter Web Client</a>","SenWarren",514,FALSE,FALSE,NA,NA
"718","Should we really be surprised @realDonaldTrump &amp; @SpeakerRyan had a good talk? The GOP is already lined up behind his extreme policies.",FALSE,3239,NA,2016-05-12 19:22:14,FALSE,NA,"730840526291910656",NA,"<a href=""http://twitter.com"" rel=""nofollow"">Twitter Web Client</a>","SenWarren",1408,FALSE,FALSE,NA,NA
"719",".@RepJohnConyers &amp; I, &amp; 100+ Congress members, sent a letter to Fed Chair Yellen about the Fed’s diversity problem: https://t.co/lRHP7Fw4Kp",FALSE,334,NA,2016-05-12 17:48:40,FALSE,NA,"730816978160627713",NA,"<a href=""http://twitter.com"" rel=""nofollow"">Twitter Web Client</a>","SenWarren",133,FALSE,FALSE,NA,NA
"720","I appreciate @RepJohnConyers' leadership on this letter, and his long record of leadership on civil rights and diversity issues.",FALSE,448,NA,2016-05-12 17:46:39,FALSE,NA,"730816473929818112",NA,"<a href=""http://twitter.com"" rel=""nofollow"">Twitter Web Client</a>","SenWarren",111,FALSE,FALSE,NA,NA
"721","Unemployment is 4% for white Americans. It’s 9% for African-Americans. Economic recovery has never fully reached Black &amp; Latino communities.",FALSE,1687,NA,2016-05-12 17:44:31,FALSE,NA,"730815934835871744",NA,"<a href=""http://twitter.com"" rel=""nofollow"">Twitter Web Client</a>","SenWarren",949,FALSE,FALSE,NA,NA
"722","A lack of diverse leadership is hurting the @FederalReserve’s policy decision-making process. https://t.co/LZO88IOfyN",FALSE,1529,NA,2016-05-12 17:43:52,FALSE,NA,"730815770045915136",NA,"<a href=""http://twitter.com"" rel=""nofollow"">Twitter Web Client</a>","SenWarren",695,FALSE,FALSE,NA,NA
"723",".@SenTomCotton &amp; I sent a letter to @finra_news about steps it is taking to address financial advisor misconduct: https://t.co/8h2PLYQnhG",FALSE,520,NA,2016-05-11 22:06:44,FALSE,NA,"730519536219328512",NA,"<a href=""http://twitter.com"" rel=""nofollow"">Twitter Web Client</a>","SenWarren",159,FALSE,FALSE,NA,NA
"724","Someone who makes a living trying to kill Social Security shouldn’t be put in charge of overseeing it. No fox guarding the henhouse.",FALSE,4696,NA,2016-05-11 21:39:14,FALSE,NA,"730512614615322624",NA,"<a href=""http://twitter.com"" rel=""nofollow"">Twitter Web Client</a>","SenWarren",1819,FALSE,FALSE,NA,NA
"725","Chuck Blahous, the GOP Social Security Board nominee, has spent his career crusading to dismantle Social Security. https://t.co/46jQmSh0zp",FALSE,999,NA,2016-05-11 21:38:40,FALSE,NA,"730512471862185984",NA,"<a href=""http://twitter.com"" rel=""nofollow"">Twitter Web Client</a>","SenWarren",892,FALSE,FALSE,NA,NA
"726","Read my new @SunTimes op-ed with @RepDuckworth on why Congress needs to pass our #SAVEBenefits Act: https://t.co/py36w6wJZJ",FALSE,674,NA,2016-05-03 20:15:31,FALSE,NA,"727592446192975874",NA,"<a href=""http://twitter.com"" rel=""nofollow"">Twitter Web Client</a>","SenWarren",358,FALSE,FALSE,NA,NA
"727","Millions of seniors, vets &amp; disabled Americans struggle on Social Security, &amp; without a cost of living raise, they're struggling even more.",FALSE,2491,NA,2016-05-03 20:15:00,FALSE,NA,"727592313644568577",NA,"<a href=""http://twitter.com"" rel=""nofollow"">Twitter Web Client</a>","SenWarren",1187,FALSE,FALSE,NA,NA
"728","Too often, lawyers &amp; lobbyists bury the voices of American workers. It’s time to listen to workers who need a fighting chance. #overdueOT",FALSE,1360,NA,2016-05-02 18:24:12,FALSE,NA,"727202044948393995",NA,"<a href=""http://twitter.com"" rel=""nofollow"">Twitter Web Client</a>","SenWarren",536,FALSE,FALSE,NA,NA
"729","I sent our #overdueOT report to OMB Director @ShaunOMB, urging him to listen to American workers. https://t.co/OehbZlgneM",FALSE,245,NA,2016-05-02 18:22:55,FALSE,NA,"727201719139094531",NA,"<a href=""http://twitter.com"" rel=""nofollow"">Twitter Web Client</a>","SenWarren",83,FALSE,FALSE,NA,NA
"730","Read our new report w/ workers in all 50 states saying what new overtime rules would mean to them: https://t.co/R28FjGtX0f #overdueOT",FALSE,272,NA,2016-05-02 18:20:34,FALSE,NA,"727201126873968640",NA,"<a href=""http://twitter.com"" rel=""nofollow"">Twitter Web Client</a>","SenWarren",143,FALSE,FALSE,NA,NA
"731","Updating our outdated overtime rules is about economics, but it’s also about our values. #overdueOT https://t.co/gSTl95EhMu",FALSE,614,NA,2016-05-02 18:19:16,FALSE,NA,"727200800087412736",NA,"<a href=""http://twitter.com"" rel=""nofollow"">Twitter Web Client</a>","SenWarren",276,FALSE,FALSE,NA,NA
"732","If we raise the overtime threshold, millions of people – including 281k in MA – will qualify for OT. #overdueOT https://t.co/QZHWaogdW9",FALSE,654,NA,2016-05-02 18:17:42,FALSE,NA,"727200406552600576",NA,"<a href=""http://twitter.com"" rel=""nofollow"">Twitter Web Client</a>","SenWarren",305,FALSE,FALSE,NA,NA
"733",".@USDOL proposed a strong new rule to close the overtime loophole &amp; ensure a hard day’s work is rewarded with a fair day’s pay. #overdueOT",FALSE,345,NA,2016-05-02 18:16:35,FALSE,NA,"727200126385676290",NA,"<a href=""http://twitter.com"" rel=""nofollow"">Twitter Web Client</a>","SenWarren",134,FALSE,FALSE,NA,NA
"734","Fast food workers, janitors, grocery clerks – anyone is called a ""manager"" to avoid overtime. It’s crazy. #overdueOT https://t.co/eXhPqO5RzL",FALSE,1132,NA,2016-05-02 18:15:23,FALSE,NA,"727199823301083136",NA,"<a href=""http://twitter.com"" rel=""nofollow"">Twitter Web Client</a>","SenWarren",538,FALSE,FALSE,NA,NA
"735","Employers can abuse a loophole by classifying anyone making over $23k/yr as a manager to avoid OT pay. #overdueOT https://t.co/W8gDoxNpY2",FALSE,934,NA,2016-05-02 18:13:49,FALSE,NA,"727199430378700800",NA,"<a href=""http://twitter.com"" rel=""nofollow"">Twitter Web Client</a>","SenWarren",595,FALSE,FALSE,NA,NA
"736","Only 8% of salaried workers qualify for guaranteed overtime pay because the rules are so old. #overdueOT",FALSE,517,NA,2016-05-02 18:11:43,FALSE,NA,"727198902982692864",NA,"<a href=""http://twitter.com"" rel=""nofollow"">Twitter Web Client</a>","SenWarren",218,FALSE,FALSE,NA,NA
"737","Thank you @RepStephenLynch &amp; @SenMarkey for your leadership, &amp; Rolling Thunder for your hard work to get our POW/MIA bill passed &amp; signed.",FALSE,380,NA,2016-05-02 16:37:54,FALSE,NA,"727175291756511232",NA,"<a href=""http://twitter.com"" rel=""nofollow"">Twitter Web Client</a>","SenWarren",98,FALSE,FALSE,NA,NA
"738","I’m glad that @POTUS signed into law my bipartisan Ntl POW/MIA Remembrance Act to place a commemorative POW/MIA chair in the US Capitol.",FALSE,797,NA,2016-05-02 16:37:10,FALSE,NA,"727175108964585474",NA,"<a href=""http://twitter.com"" rel=""nofollow"">Twitter Web Client</a>","SenWarren",189,FALSE,FALSE,NA,NA
"739","It’s our duty to honor those who have served our nation with courage, including those who have not made it home.",FALSE,670,NA,2016-05-02 16:36:52,FALSE,NA,"727175030166159360",NA,"<a href=""http://twitter.com"" rel=""nofollow"">Twitter Web Client</a>","SenWarren",184,FALSE,FALSE,NA,NA
"740","Boston isn't waiting for Congress to step up &amp; make debt-free college a reality. Great work, @marty_walsh! https://t.co/jJX0jRaHbn",FALSE,2023,NA,2016-04-29 21:56:09,FALSE,NA,"726168217996148738",NA,"<a href=""http://twitter.com"" rel=""nofollow"">Twitter Web Client</a>","SenWarren",778,FALSE,FALSE,NA,NA
"741","Today I went to the Senate floor to ask the @SenateGOP: Where’s your plan to fund the #Zika emergency response? https://t.co/PDwJ6S2YjT",FALSE,1322,NA,2016-04-28 21:33:47,FALSE,NA,"725800202720915456",NA,"<a href=""http://twitter.com"" rel=""nofollow"">Twitter Web Client</a>","SenWarren",577,FALSE,FALSE,NA,NA
"742","Now we have a real, genuine health crisis in America — the #Zika virus — and the @SenateGOP have done nothing but get ready for vacation.",FALSE,1807,NA,2016-04-28 21:32:57,FALSE,NA,"725799993530028032",NA,"<a href=""http://twitter.com"" rel=""nofollow"">Twitter Web Client</a>","SenWarren",979,FALSE,FALSE,NA,NA
"743","Republicans won control of the Senate in 2014 in part by terrifying people w/ totally made-up stories about the Ebola virus. #Zika",FALSE,1194,NA,2016-04-28 21:32:06,FALSE,NA,"725799776286040070",NA,"<a href=""http://twitter.com"" rel=""nofollow"">Twitter Web Client</a>","SenWarren",526,FALSE,FALSE,NA,NA
"744","I'm glad to join strong women like ones on our @ussoccer #USWNT to fight for equal pay - in offices, factories, &amp; yes, on the soccer field.",FALSE,2132,NA,2016-04-25 00:01:44,FALSE,NA,"724387882664906752",NA,"<a href=""http://twitter.com"" rel=""nofollow"">Twitter Web Client</a>","SenWarren",684,FALSE,FALSE,NA,NA
"745","Happy to join the @BostonBreakers to kick off their season tonight! #BOSvSEA https://t.co/O4gLQzF58I",FALSE,774,NA,2016-04-25 00:00:31,FALSE,NA,"724387579001450496",NA,"<a href=""http://twitter.com"" rel=""nofollow"">Twitter Web Client</a>","SenWarren",160,FALSE,FALSE,NA,NA
"746","Read my letter to Chair Mary Jo White about my serious concerns with the SEC: https://t.co/8CHbzCAIpH",FALSE,398,NA,2016-04-21 15:11:56,FALSE,NA,"723167389630631936",NA,"<a href=""http://twitter.com"" rel=""nofollow"">Twitter Web Client</a>","SenWarren",231,FALSE,FALSE,NA,NA
"747","This decision is a mockery of the SEC's core mission &amp; the latest example of the SEC failing to punish guilty parties &amp; protect investors.",FALSE,1008,NA,2016-04-21 15:11:30,FALSE,NA,"723167283615391744",NA,"<a href=""http://twitter.com"" rel=""nofollow"">Twitter Web Client</a>","SenWarren",425,FALSE,FALSE,NA,NA
"748","Just 2 months after Cohen's sanction, the SEC approved the application of a new investment firm co-owned by… Steven Cohen. Seriously.",FALSE,648,NA,2016-04-21 15:11:05,FALSE,NA,"723167178980093953",NA,"<a href=""http://twitter.com"" rel=""nofollow"">Twitter Web Client</a>","SenWarren",420,FALSE,FALSE,NA,NA
"749","SAC Capital pled guilty to insider trading in 2013. In Jan, the SEC barred its manager Steven Cohen from managing outside funds until 2018.",FALSE,566,NA,2016-04-21 15:10:40,FALSE,NA,"723167074114105345",NA,"<a href=""http://twitter.com"" rel=""nofollow"">Twitter Web Client</a>","SenWarren",303,FALSE,FALSE,NA,NA
"750","Wall St broke our economy — not Central States Pension Fund workers. @USTreasury should reject their pension cuts. https://t.co/G5vMtGGfe2",FALSE,1204,NA,2016-04-20 18:31:04,FALSE,NA,"722855117347643393",NA,"<a href=""http://twitter.com"" rel=""nofollow"">Twitter Web Client</a>","SenWarren",716,FALSE,FALSE,NA,NA
"751","In 2008, Wall Street got a bailout. What did those truck drivers, dockworkers &amp; warehouse workers get? They got stuck with bill.",FALSE,1692,NA,2016-04-20 18:30:18,FALSE,NA,"722854921775632384",NA,"<a href=""http://twitter.com"" rel=""nofollow"">Twitter Web Client</a>","SenWarren",854,FALSE,FALSE,NA,NA
"752","Goldman Sachs &amp; Northern Trust got $41M to manage workers’ pension funds, &amp; they recklessly gambled it on junk bonds &amp; toxic mortgages.",FALSE,1363,NA,2016-04-20 18:29:54,FALSE,NA,"722854821720502272",NA,"<a href=""http://twitter.com"" rel=""nofollow"">Twitter Web Client</a>","SenWarren",923,FALSE,FALSE,NA,NA
"753","Congrats to @fstockman &amp; @jrinaldi5 on your @BostonGlobe Pulitzer Prizes! All of MA is grateful for your fantastic work. #Pulitzer100",FALSE,358,NA,2016-04-18 21:46:06,FALSE,NA,"722179424829968385",NA,"<a href=""http://twitter.com"" rel=""nofollow"">Twitter Web Client</a>","SenWarren",78,FALSE,FALSE,NA,NA
"754","Verizon workers are fighting for their jobs &amp; respect. Glad to join MA workers on the picket line in Cambridge. #1u https://t.co/79tyOz7hER",FALSE,2320,NA,2016-04-18 17:04:12,FALSE,NA,"722108480925134848",NA,"<a href=""http://twitter.com"" rel=""nofollow"">Twitter Web Client</a>","SenWarren",787,FALSE,FALSE,NA,NA
"755","Happy Patriots' Day, Massachusetts! And good luck to the #BostonMarathon runners!",FALSE,792,NA,2016-04-18 12:49:20,FALSE,NA,"722044339237486592",NA,"<a href=""http://twitter.com"" rel=""nofollow"">Twitter Web Client</a>","SenWarren",216,FALSE,FALSE,NA,NA
"756","We have a simple ask this #OneBostonDay: Do something nice for someone
today. Those are Boston values, &amp; those are American values.",FALSE,645,NA,2016-04-15 19:01:04,FALSE,NA,"721050726454149120",NA,"<a href=""http://twitter.com"" rel=""nofollow"">Twitter Web Client</a>","SenWarren",256,FALSE,FALSE,NA,NA
"757","Today we remember the victims &amp; survivors of the Boston Marathon tragedy &amp; the strength of the people of Boston by celebrating #OneBostonDay",FALSE,730,NA,2016-04-15 19:00:27,FALSE,NA,"721050570572886016",NA,"<a href=""http://twitter.com"" rel=""nofollow"">Twitter Web Client</a>","SenWarren",264,FALSE,FALSE,NA,NA
"758","It’s time for the @SenateGOP to #doyourjob &amp; hold hearings, consider his nomination in good faith, &amp; give Judge Garland an up-or-down vote.",FALSE,1375,NA,2016-04-14 22:17:14,FALSE,NA,"720737704535830529",NA,"<a href=""http://twitter.com"" rel=""nofollow"">Twitter Web Client</a>","SenWarren",599,FALSE,FALSE,NA,NA
"759","Pleased to meet today with Chief Judge Garland, @POTUS’s impressive nominee to serve on the Supreme Court. https://t.co/PuSNauAkWE",FALSE,2198,NA,2016-04-14 22:16:33,FALSE,NA,"720737533072646144",NA,"<a href=""http://twitter.com"" rel=""nofollow"">Twitter Web Client</a>","SenWarren",578,FALSE,FALSE,NA,NA
"760","That’s the definition of “unbelievable” in the real world – but it’s business as usual in the cozy world of Wall Street.",FALSE,571,NA,2016-04-14 21:16:41,FALSE,NA,"720722467258515456",NA,"<a href=""http://twitter.com"" rel=""nofollow"">Twitter Web Client</a>","SenWarren",210,FALSE,FALSE,NA,NA
"761","“Unbelievable”? Yes, totally unbelievable that JPM could get tagged as TBTF &amp; then pat each other on the backs &amp; say “heckuva job.”",FALSE,587,NA,2016-04-14 21:16:13,FALSE,NA,"720722351722205184",NA,"<a href=""http://twitter.com"" rel=""nofollow"">Twitter Web Client</a>","SenWarren",258,FALSE,FALSE,NA,NA
"762","Federal regulators said this week that JPMorgan is still Too Big to Fail. CEO Jamie Dimon's reaction? https://t.co/wye5It2fYH",FALSE,540,NA,2016-04-14 21:15:44,FALSE,NA,"720722230070616064",NA,"<a href=""http://twitter.com"" rel=""nofollow"">Twitter Web Client</a>","SenWarren",344,FALSE,FALSE,NA,NA
"763","Too often gov works for those who can hire armies of lawyers &amp; lobbyists. But not always. #SaveYourSavings",FALSE,508,NA,2016-04-06 17:32:22,FALSE,NA,"717766915977060352",NA,"<a href=""http://twitter.com"" rel=""nofollow"">Twitter Web Client</a>","SenWarren",161,FALSE,FALSE,NA,NA
"764","Remember: Paying off your student loans &amp; getting out of debt is an investment in your future too. #SaveYourSavings",FALSE,277,"SenWarren",2016-04-06 17:29:37,FALSE,"717765987500695552","717766223635877889","970207298","<a href=""http://twitter.com"" rel=""nofollow"">Twitter Web Client</a>","SenWarren",75,FALSE,FALSE,NA,NA
"765",".@CoryBooker And count dollars, not just pennies. Find ways to save on big-ticket budget items like rent &amp; transportation. #SaveYourSavings",FALSE,176,"CoryBooker",2016-04-06 17:28:41,FALSE,"717764129793114112","717765987500695552","15808765","<a href=""http://twitter.com"" rel=""nofollow"">Twitter Web Client</a>","SenWarren",45,FALSE,FALSE,NA,NA
"766","Most people assume that. It explains why ppl lose $17B/yr trusting retirement advisers. #SaveYourSavings https://t.co/yhqDMBayOK",FALSE,414,NA,2016-04-06 17:25:33,FALSE,NA,"717765199500087296",NA,"<a href=""http://twitter.com"" rel=""nofollow"">Twitter Web Client</a>","SenWarren",269,FALSE,FALSE,NA,NA
"767","Conflict of interest rules existed for doctors &amp; lawyers, but not retirement advisers. It's nuts! #SaveYourSavings  https://t.co/QqqV2KszW5",FALSE,532,NA,2016-04-06 17:22:58,FALSE,NA,"717764550846754816",NA,"<a href=""http://twitter.com"" rel=""nofollow"">Twitter Web Client</a>","SenWarren",294,FALSE,FALSE,NA,NA
"768","If student loan refi means $70/month more in your pocket, that's $ you can put into retirement saving. #SaveYourSavings",FALSE,330,"SenWarren",2016-04-06 17:16:34,FALSE,"717762808742588416","717762938824749056","970207298","<a href=""http://twitter.com"" rel=""nofollow"">Twitter Web Client</a>","SenWarren",111,FALSE,FALSE,NA,NA
"769","That's why Senate Dems are also pushing our #InTheRed legislation to help students &amp; young people. #SaveYourSavings",FALSE,233,"SenWarren",2016-04-06 17:16:03,FALSE,"717762585861431296","717762808742588416","970207298","<a href=""http://twitter.com"" rel=""nofollow"">Twitter Web Client</a>","SenWarren",68,FALSE,FALSE,NA,NA
"770","YES, young ppl are getting crushed w/ debt, making it really tough to save for retirement. #SaveYourSavings https://t.co/tscRF2vZUC",FALSE,433,NA,2016-04-06 17:15:10,FALSE,NA,"717762585861431296",NA,"<a href=""http://twitter.com"" rel=""nofollow"">Twitter Web Client</a>","SenWarren",187,FALSE,FALSE,NA,NA
"771","One witness at a forum called himself a frog in warm water – he didn’t know he was being cooked until too late. #SaveYourSavings",FALSE,189,"SenWarren",2016-04-06 17:12:09,FALSE,"717761570244263937","717761827854229505","970207298","<a href=""http://twitter.com"" rel=""nofollow"">Twitter Web Client</a>","SenWarren",54,FALSE,FALSE,NA,NA
"772","Listen to the heartbreaking stories of people who got duped: https://t.co/9DYxfn8K4P #SaveYourSavings https://t.co/gpt1yuYrje",FALSE,192,NA,2016-04-06 17:11:08,FALSE,NA,"717761570244263937",NA,"<a href=""http://twitter.com"" rel=""nofollow"">Twitter Web Client</a>","SenWarren",79,FALSE,FALSE,NA,NA
"773","Glad to be here w/ @LaborSec &amp; @CoryBooker to talk about @USDOL’s new conflict of interest rule! #SaveYourSavings https://t.co/2vkIzKYk6Y",FALSE,601,NA,2016-04-06 16:57:12,FALSE,NA,"717758063957123074",NA,"<a href=""http://twitter.com"" rel=""nofollow"">Twitter Web Client</a>","SenWarren",154,FALSE,FALSE,NA,NA
"774","Happy to join @LaborSec as he announces @USDOL’s new conflict of interest rule. Watch live: https://t.co/9ZUEzRN6lM #SaveYourSavings",FALSE,232,NA,2016-04-06 15:34:14,FALSE,NA,"717737184913174528",NA,"<a href=""http://twitter.com"" rel=""nofollow"">Twitter Web Client</a>","SenWarren",84,FALSE,FALSE,NA,NA
"775","Great news: Today @USDOL is announcing a strong new conflict of interest rule so advisers put clients first. #SaveYourSavings",FALSE,699,NA,2016-04-06 15:33:19,FALSE,NA,"717736954276745216",NA,"<a href=""http://twitter.com"" rel=""nofollow"">Twitter Web Client</a>","SenWarren",247,FALSE,FALSE,NA,NA
"776","We wrote a report on perks advisers can get for selling retirement products – even bad ones. https://t.co/blrXYybMbU #SaveYourSavings",FALSE,214,NA,2016-04-06 15:32:51,FALSE,NA,"717736837326966784",NA,"<a href=""http://twitter.com"" rel=""nofollow"">Twitter Web Client</a>","SenWarren",93,FALSE,FALSE,NA,NA
"777","Loopholes have made it perfectly legal for retirement advisers to take kickbacks for selling lousy products. #SaveYourSavings",FALSE,609,NA,2016-04-06 15:32:21,FALSE,NA,"717736711707627521",NA,"<a href=""http://twitter.com"" rel=""nofollow"">Twitter Web Client</a>","SenWarren",284,FALSE,FALSE,NA,NA
"778","Most retirement advisers do what’s in their clients’ best interests, but not all of them. #SaveYourSavings",FALSE,300,NA,2016-04-06 15:31:59,FALSE,NA,"717736617562255360",NA,"<a href=""http://twitter.com"" rel=""nofollow"">Twitter Web Client</a>","SenWarren",94,FALSE,FALSE,NA,NA
"779","Glad to have Ed Kelly &amp; @THE_PFFM stop by our DC office. Our firefighters have our backs - &amp; we need to have theirs. https://t.co/RaXVy2ryAc",FALSE,648,NA,2016-04-06 00:10:53,FALSE,NA,"717504818294702082",NA,"<a href=""http://twitter.com"" rel=""nofollow"">Twitter Web Client</a>","SenWarren",127,FALSE,FALSE,NA,NA
"780","I asked Chanin: Given his abysmal track record at the Fed, why should anyone take him seriously? Watch: https://t.co/UERGA0cdbb",FALSE,736,NA,2016-04-05 17:39:34,FALSE,NA,"717406339908153345",NA,"<a href=""http://twitter.com"" rel=""nofollow"">Twitter Web Client</a>","SenWarren",352,FALSE,FALSE,NA,NA
"781","The bipartisan Financial Crisis Inquiry Comm said this ""pivotal failure"" was a ""prime example"" of how regulators let the meltdown happen.",FALSE,546,NA,2016-04-05 17:38:35,FALSE,NA,"717406090162520064",NA,"<a href=""http://twitter.com"" rel=""nofollow"">Twitter Web Client</a>","SenWarren",227,FALSE,FALSE,NA,NA
"782","One witness had led the Fed division that refused to regulate deceptive mortgages, including subprime lending that helped spark the crisis.",FALSE,548,NA,2016-04-05 17:38:04,FALSE,NA,"717405960336228353",NA,"<a href=""http://twitter.com"" rel=""nofollow"">Twitter Web Client</a>","SenWarren",227,FALSE,FALSE,NA,NA
"783",".@BankingGOP held a hearing today to talk about why we should roll back rules on mortgages &amp; credit cards because they’re just too costly.",FALSE,582,NA,2016-04-05 17:37:48,FALSE,NA,"717405893860704256",NA,"<a href=""http://twitter.com"" rel=""nofollow"">Twitter Web Client</a>","SenWarren",254,FALSE,FALSE,NA,NA
"784","Everyone who is serious about standing up for borrowers with #studentdebt should embrace these fundamentals. Watch: https://t.co/UCbEQsl2Im",FALSE,975,NA,2016-03-30 15:55:50,FALSE,NA,"715205907081207809",NA,"<a href=""http://twitter.com"" rel=""nofollow"">Twitter Web Client</a>","SenWarren",494,FALSE,FALSE,NA,NA
"785","I’ve laid out 5 simple reform fundamentals for @usedgov’s student loan program to clean up its act. #studentdebt https://t.co/3RAZJRlLCQ",FALSE,2820,NA,2016-03-30 15:54:57,FALSE,NA,"715205681629028352",NA,"<a href=""http://twitter.com"" rel=""nofollow"">Twitter Web Client</a>","SenWarren",1672,FALSE,FALSE,NA,NA
"786","It’s past time for @usedgov’s bank to start running the student loan program to benefit students, not companies like Navient. #studentdebt",FALSE,1289,NA,2016-03-30 15:53:30,FALSE,NA,"715205320319049728",NA,"<a href=""http://twitter.com"" rel=""nofollow"">Twitter Web Client</a>","SenWarren",549,FALSE,FALSE,NA,NA
"787","Instead of holding Navient accountable, @usedgov’s student loan bank covered for them. Outrageous, but not surprising. #studentdebt",FALSE,779,NA,2016-03-30 15:53:09,FALSE,NA,"715205230921654272",NA,"<a href=""http://twitter.com"" rel=""nofollow"">Twitter Web Client</a>","SenWarren",411,FALSE,FALSE,NA,NA
"788","Navient, one of the biggest student loan servicers, got caught cheating American soldiers on student loans. #studentdebt",FALSE,1038,NA,2016-03-30 15:52:43,FALSE,NA,"715205122029174785",NA,"<a href=""http://twitter.com"" rel=""nofollow"">Twitter Web Client</a>","SenWarren",771,FALSE,FALSE,NA,NA
"789","Our DC staff members are safe, &amp; we are all very grateful for the Capitol Police &amp; their heroic work to protect us today &amp; every day.",FALSE,2384,NA,2016-03-28 19:53:29,FALSE,NA,"714540936055889921",NA,"<a href=""http://twitter.com"" rel=""nofollow"">Twitter Web Client</a>","SenWarren",354,FALSE,FALSE,NA,NA
"790","#ff to my friend @SenFranken, who has a brand-new office Twitter account. He's good enough, smart enough, &amp; doggone it, people like him.",FALSE,2662,NA,2016-03-25 16:15:13,FALSE,NA,"713398846114701312",NA,"<a href=""http://twitter.com"" rel=""nofollow"">Twitter Web Client</a>","SenWarren",649,FALSE,FALSE,NA,NA
"791","Terrific visit to the South Cove Community Health Center in Quincy. I LOVE what community health centers do. https://t.co/g3BeJBHhhX",FALSE,1061,NA,2016-03-24 19:16:54,FALSE,NA,"713082179941695489",NA,"<a href=""http://twitter.com"" rel=""nofollow"">Twitter Web Client</a>","SenWarren",174,FALSE,FALSE,NA,NA
"792","We should never cower to fear by turning against our neighbors or by rejecting our values.",FALSE,2588,NA,2016-03-22 20:17:56,FALSE,NA,"712372764489981952",NA,"<a href=""http://twitter.com"" rel=""nofollow"">Twitter Web Client</a>","SenWarren",1271,FALSE,FALSE,NA,NA
"793","Terrorists must have no place to run &amp; hide, but we must also remember that terrorists commit acts of violence to paralyze &amp; divide us.",FALSE,2724,NA,2016-03-22 20:17:25,FALSE,NA,"712372634512695296",NA,"<a href=""http://twitter.com"" rel=""nofollow"">Twitter Web Client</a>","SenWarren",1123,FALSE,FALSE,NA,NA
"794","Our job is to work closely with our allies around the world to fight terrorism wherever it occurs.",FALSE,1029,NA,2016-03-22 20:17:11,FALSE,NA,"712372574886490112",NA,"<a href=""http://twitter.com"" rel=""nofollow"">Twitter Web Client</a>","SenWarren",258,FALSE,FALSE,NA,NA
"795","America stands with the people of Brussels, the victims &amp; families of those killed &amp; injured, &amp; the city’s heroic first responders.",FALSE,1736,NA,2016-03-22 20:16:53,FALSE,NA,"712372500286607364",NA,"<a href=""http://twitter.com"" rel=""nofollow"">Twitter Web Client</a>","SenWarren",462,FALSE,FALSE,NA,NA
