"","text","favorited","favoriteCount","replyToSN","created","truncated","replyToSID","id","replyToUID","statusSource","screenName","retweetCount","isRetweet","retweeted","longitude","latitude"
"474","Anyone in Congress – GOP or Dem – who votes to weaken the @CFPB will declare loud &amp; clear they represent giant banks, not working families.",FALSE,4173,NA,2016-11-14 18:09:05,FALSE,NA,"798226261843779584",NA,"<a href=""http://twitter.com"" rel=""nofollow"">Twitter Web Client</a>","SenWarren",1939,FALSE,FALSE,NA,NA
"475","The @CFPB has returned over $11 BILLION to consumers who have been cheated by big banks &amp; financial institutions.",FALSE,2142,NA,2016-11-14 18:07:39,FALSE,NA,"798225901599109120",NA,"<a href=""http://twitter.com"" rel=""nofollow"">Twitter Web Client</a>","SenWarren",930,FALSE,FALSE,NA,NA
"476","If I were Wall Street &amp; the GOP, I’d be scared too: The @CFPB goes after big banks like @WellsFargo when they break the law.",FALSE,1599,NA,2016-11-14 18:06:28,FALSE,NA,"798225603929378816",NA,"<a href=""http://twitter.com"" rel=""nofollow"">Twitter Web Client</a>","SenWarren",610,FALSE,FALSE,NA,NA
"477","The real reason Wall St &amp; their @GOP allies are going after the @CFPB is because it’s working too darn well for consumers &amp; must be stopped.",FALSE,2535,NA,2016-11-14 18:05:16,FALSE,NA,"798225299129307136",NA,"<a href=""http://twitter.com"" rel=""nofollow"">Twitter Web Client</a>","SenWarren",1138,FALSE,FALSE,NA,NA
"478","You’re going to hear a lot of reasons why we must make these changes to the @CFPB. Not one of them is going to be true.",FALSE,1543,NA,2016-11-14 18:04:17,FALSE,NA,"798225052906889217",NA,"<a href=""http://twitter.com"" rel=""nofollow"">Twitter Web Client</a>","SenWarren",626,FALSE,FALSE,NA,NA
"479","It’s only been a few days since the election &amp; Wall St banks &amp; their @GOP friends are already licking their chops to undercut the @CFPB.",FALSE,1738,NA,2016-11-14 18:03:28,FALSE,NA,"798224848732520448",NA,"<a href=""http://twitter.com"" rel=""nofollow"">Twitter Web Client</a>","SenWarren",836,FALSE,FALSE,NA,NA
"480","And @FCC should ban unreasonable pay-for-privacy schemes that coerce consumers to give up #privacy for discounts. https://t.co/CG8MNN9LcJ",FALSE,1464,NA,2016-10-21 18:28:23,FALSE,NA,"789533806831235072",NA,"<a href=""http://twitter.com"" rel=""nofollow"">Twitter Web Client</a>","SenWarren",613,FALSE,FALSE,NA,NA
"481","The @FCC can do something about #broadband #privacy – &amp; they should @TomWheelerFCC @JRosenworcel @MClyburnFCC @AjitPaiFCC @mikeofcc",FALSE,847,NA,2016-10-21 18:26:19,FALSE,NA,"789533289652621312",NA,"<a href=""http://twitter.com"" rel=""nofollow"">Twitter Web Client</a>","SenWarren",308,FALSE,FALSE,NA,NA
"482","Right now we have no #broadband #privacy rules to protect consumers – no rules on how companies can collect, use, share, &amp; sell our data.",FALSE,1979,NA,2016-10-21 18:25:28,FALSE,NA,"789533075533422592",NA,"<a href=""http://twitter.com"" rel=""nofollow"">Twitter Web Client</a>","SenWarren",906,FALSE,FALSE,NA,NA
"483","Great to see the @nytimes agrees it’s time to pass my Accreditation Reform and Enhanced Accountability Act: https://t.co/tqk48zWDlu",FALSE,1914,NA,2016-10-20 18:27:01,FALSE,NA,"789171076752211969",NA,"<a href=""http://twitter.com"" rel=""nofollow"">Twitter Web Client</a>","SenWarren",551,FALSE,FALSE,NA,NA
"484","Glad to write the intro for @acslaw’s new Big Ideas report on top policy recs for the next administration: https://t.co/0oOlgE16oz",FALSE,634,NA,2016-10-20 14:53:25,FALSE,NA,"789117323038879749",NA,"<a href=""http://twitter.com"" rel=""nofollow"">Twitter Web Client</a>","SenWarren",114,FALSE,FALSE,NA,NA
"485","Congress should pass the #SAVEBenefits Act in Nov to give a much-needed boost to millions of Americans on Soc Security who have earned it.",FALSE,2439,NA,2016-10-18 21:29:14,FALSE,NA,"788492159083216896",NA,"<a href=""http://twitter.com"" rel=""nofollow"">Twitter Web Client</a>","SenWarren",839,FALSE,FALSE,NA,NA
"486",".@RepDuckworth &amp; I introduced the #SAVEBenefits Act to give 70M Americans a one-time 3.9% Social Security payment. There's still time.",FALSE,1453,NA,2016-10-18 21:28:04,FALSE,NA,"788491862466322433",NA,"<a href=""http://twitter.com"" rel=""nofollow"">Twitter Web Client</a>","SenWarren",553,FALSE,FALSE,NA,NA
"487","Today the @SocialSecurity Admin announced a 0.3% COLA for 2017. For many Americans struggling to make ends meet, that offers little relief.",FALSE,1543,NA,2016-10-18 21:27:02,FALSE,NA,"788491602218086400",NA,"<a href=""http://twitter.com"" rel=""nofollow"">Twitter Web Client</a>","SenWarren",545,FALSE,FALSE,NA,NA
"488","The SEC needs new leadership to return to its mission to protect investors. @POTUS should use his authority to designate a new chair today",FALSE,1116,"SenWarren",2016-10-14 17:16:14,FALSE,"786978551136456704","786978936181944320","970207298","<a href=""https://about.twitter.com/products/tweetdeck"" rel=""nofollow"">TweetDeck</a>","SenWarren",350,FALSE,FALSE,NA,NA
"489","SEC Chair White has refused to advance a rule to require public corporations to disclose political spending despite broad bipartisan support",FALSE,1000,"SenWarren",2016-10-14 17:14:42,FALSE,"786978228976099328","786978551136456704","970207298","<a href=""https://about.twitter.com/products/tweetdeck"" rel=""nofollow"">TweetDeck</a>","SenWarren",406,FALSE,FALSE,NA,NA
"490","But under Chair White the SEC routinely ignores needs of investors to cater to interests of big businesses, dragging its feet on key rules",FALSE,364,"SenWarren",2016-10-14 17:13:25,FALSE,"786977891242348544","786978228976099328","970207298","<a href=""https://about.twitter.com/products/tweetdeck"" rel=""nofollow"">TweetDeck</a>","SenWarren",165,FALSE,FALSE,NA,NA
"491","The SEC has a simple purpose: to protect investors by ensuring they have the information they need to make decisions",FALSE,361,"SenWarren",2016-10-14 17:12:05,FALSE,"786977440077930496","786977891242348544","970207298","<a href=""https://about.twitter.com/products/tweetdeck"" rel=""nofollow"">TweetDeck</a>","SenWarren",146,FALSE,FALSE,NA,NA
"492","Today I asked @POTUS to immediately designate a new Chair of the SEC to replace Mary Jo White: https://t.co/Jin8kvpbZ5",FALSE,1541,NA,2016-10-14 17:10:17,FALSE,NA,"786977440077930496",NA,"<a href=""https://about.twitter.com/products/tweetdeck"" rel=""nofollow"">TweetDeck</a>","SenWarren",530,FALSE,FALSE,NA,NA
"493","I am heartsick for the 2 brave @bostonpolice officers shot in Boston, their families &amp; the entire BPD. Our gratitude &amp; prayers are with you.",FALSE,2233,NA,2016-10-13 16:49:48,FALSE,NA,"786609896758185985",NA,"<a href=""http://twitter.com"" rel=""nofollow"">Twitter Web Client</a>","SenWarren",361,FALSE,FALSE,NA,NA
"494","A bank CEO should not be able to oversee a massive fraud &amp; simply walk away to enjoy his millions in retirement.",FALSE,7007,NA,2016-10-12 23:13:18,FALSE,NA,"786344019567648768",NA,"<a href=""http://twitter.com"" rel=""nofollow"">Twitter Web Client</a>","SenWarren",2759,FALSE,FALSE,NA,NA
"495","A bank teller would face criminal charges &amp; a prison sentence for stealing a handful of 20s from the cash drawer.",FALSE,3696,NA,2016-10-12 23:12:10,FALSE,NA,"786343735869120512",NA,"<a href=""http://twitter.com"" rel=""nofollow"">Twitter Web Client</a>","SenWarren",1246,FALSE,FALSE,NA,NA
"496","If @WellsFargo’s John Stumpf is leaving with all of his ill-gotten millions, that's still not real accountability.",FALSE,3650,NA,2016-10-12 23:10:59,FALSE,NA,"786343438216069120",NA,"<a href=""http://twitter.com"" rel=""nofollow"">Twitter Web Client</a>","SenWarren",1336,FALSE,FALSE,NA,NA
"497","As I said: @WellsFargo CEO Stumpf should resign, return every nickel he made during the scam, &amp; face DOJ/SEC investigation. He’s 1 for 3.",FALSE,5296,NA,2016-10-12 23:08:54,FALSE,NA,"786342912036450304",NA,"<a href=""http://twitter.com"" rel=""nofollow"">Twitter Web Client</a>","SenWarren",1846,FALSE,FALSE,NA,NA
"498","I'm proud of MA's cranberry heritage &amp; I'm fighting for our cranberry growers. https://t.co/If2gw8iN7V",FALSE,2812,NA,2016-10-10 21:32:12,FALSE,NA,"785593802257997824",NA,"<a href=""http://twitter.com/download/iphone"" rel=""nofollow"">Twitter for iPhone</a>","SenWarren",269,FALSE,FALSE,NA,NA
"499","I've been looking forward to visiting our MA cranberry bogs all year! https://t.co/PrLdF8T3fh",FALSE,1048,NA,2016-10-10 21:30:06,FALSE,NA,"785593272806891521",NA,"<a href=""http://twitter.com/download/iphone"" rel=""nofollow"">Twitter for iPhone</a>","SenWarren",105,FALSE,FALSE,NA,NA
"500","Today we put on our cranberry waders at Mann Farms of the @OceanSprayInc co-op in Buzzards Bay. https://t.co/OWwRjbosYg",FALSE,2269,NA,2016-10-10 21:28:55,FALSE,NA,"785592973409017856",NA,"<a href=""http://twitter.com/download/iphone"" rel=""nofollow"">Twitter for iPhone</a>","SenWarren",264,FALSE,FALSE,NA,NA
"501","The @CFPB just announced new rules to protect consumers from fraud and hidden fees with prepaid cards. Take a look: https://t.co/Hki6npOBlT",FALSE,2429,NA,2016-10-05 22:44:44,FALSE,NA,"783800116859789312",NA,"<a href=""https://about.twitter.com/products/tweetdeck"" rel=""nofollow"">TweetDeck</a>","SenWarren",882,FALSE,FALSE,NA,NA
"502","Watch @RepGutierrez tell this Board to open its doors to actual Puerto Ricans, not just Wall Street. https://t.co/VvYErL4IAX",FALSE,688,NA,2016-09-30 19:00:08,FALSE,NA,"781931654969524224",NA,"<a href=""http://twitter.com"" rel=""nofollow"">Twitter Web Client</a>","SenWarren",275,FALSE,FALSE,NA,NA
"503","If this unelected Board wants Puerto Rico to believe it takes their crisis seriously, they can start by leaving NY. Start by showing up.",FALSE,1384,NA,2016-09-30 18:58:54,FALSE,NA,"781931342678417408",NA,"<a href=""http://twitter.com"" rel=""nofollow"">Twitter Web Client</a>","SenWarren",593,FALSE,FALSE,NA,NA
"504","I guess holding the mtg in Puerto Rico would've been inconvenient. 20,000+ Zika cases. Recent blackouts left 1M w/o power. 340k w/o water.",FALSE,819,NA,2016-09-30 18:57:33,FALSE,NA,"781931004726501376",NA,"<a href=""http://twitter.com"" rel=""nofollow"">Twitter Web Client</a>","SenWarren",334,FALSE,FALSE,NA,NA
"505","Will this Board speak for the ppl of Puerto Rico or the bankers? Today it met for the first time - not in PR, but NYC. That's a bad start.",FALSE,1309,NA,2016-09-30 18:56:29,FALSE,NA,"781930734185480192",NA,"<a href=""http://twitter.com"" rel=""nofollow"">Twitter Web Client</a>","SenWarren",679,FALSE,FALSE,NA,NA
"506","Congress passed a bill in June to ""help"" Puerto Rico - handing authority over PR to an unelected Board, but providing no actual resources.",FALSE,797,NA,2016-09-30 18:55:30,FALSE,NA,"781930486922969088",NA,"<a href=""http://twitter.com"" rel=""nofollow"">Twitter Web Client</a>","SenWarren",456,FALSE,FALSE,NA,NA
"507","Today I joined @SenSherrodBrown, @SenSanders &amp; 9 other @SenateDems to say no to trade deals with #ISDS. https://t.co/aATYWclM2T #TPP",FALSE,889,NA,2016-09-29 20:41:09,FALSE,NA,"781594685982801920",NA,"<a href=""http://twitter.com"" rel=""nofollow"">Twitter Web Client</a>","SenWarren",349,FALSE,FALSE,NA,NA
"508","It’s time for @usedgov's student loan bank to prove they care more about Corinthian’s victims than their own bottom line.",FALSE,853,NA,2016-09-29 19:40:22,FALSE,NA,"781579392451481601",NA,"<a href=""http://twitter.com"" rel=""nofollow"">Twitter Web Client</a>","SenWarren",251,FALSE,FALSE,NA,NA
"509","Today I wrote to @usedgov demanding their student loan bank halt collection of Corinthian students’ debt: https://t.co/qk6LpjPfeP",FALSE,786,NA,2016-09-29 19:38:57,FALSE,NA,"781579032525672448",NA,"<a href=""http://twitter.com"" rel=""nofollow"">Twitter Web Client</a>","SenWarren",277,FALSE,FALSE,NA,NA
"510","That means Corinthian’s victims eligible for loan forgiveness are instead having tax refunds, EITC &amp; Social Security garnished. It’s absurd.",FALSE,754,NA,2016-09-29 19:37:59,FALSE,NA,"781578792343105536",NA,"<a href=""http://twitter.com"" rel=""nofollow"">Twitter Web Client</a>","SenWarren",318,FALSE,FALSE,NA,NA
"511","We uncovered data that instead of simply discharging the loans of Corinthian’s victims, @usedgov pushed 80k of them to debt collectors.",FALSE,706,NA,2016-09-29 19:36:57,FALSE,NA,"781578531407011840",NA,"<a href=""http://twitter.com"" rel=""nofollow"">Twitter Web Client</a>","SenWarren",381,FALSE,FALSE,NA,NA
"512","Corinthian Colleges went belly up amid findings that it defrauded students. Under fed law, those students are eligible for loan discharge.",FALSE,1124,NA,2016-09-29 19:35:59,FALSE,NA,"781578288225452032",NA,"<a href=""http://twitter.com"" rel=""nofollow"">Twitter Web Client</a>","SenWarren",452,FALSE,FALSE,NA,NA
"513","That’s the @GOP agenda in a nutshell: Pay Congress to do nothing, &amp; block back-breaking Americans from getting paid for a hard day’s work.",FALSE,2395,NA,2016-09-29 16:37:19,FALSE,NA,"781533326339432448",NA,"<a href=""http://twitter.com"" rel=""nofollow"">Twitter Web Client</a>","SenWarren",1099,FALSE,FALSE,NA,NA
"514","Last night @HouseGOP voted to delay our new overtime rule by 6 months. Kill a simple rule that hard-working people deserve to get paid.",FALSE,1825,NA,2016-09-29 16:36:21,FALSE,NA,"781533081207447552",NA,"<a href=""http://twitter.com"" rel=""nofollow"">Twitter Web Client</a>","SenWarren",1025,FALSE,FALSE,NA,NA
"515",".@SpeakerRyan’s Congress is on track to work the fewest days in decades. But what did they do last night before leaving town until November?",FALSE,1436,NA,2016-09-29 16:35:18,FALSE,NA,"781532818140635137",NA,"<a href=""http://twitter.com"" rel=""nofollow"">Twitter Web Client</a>","SenWarren",657,FALSE,FALSE,NA,NA
"516","Deepest sympathies for the family of Shimon Peres on the passing of a dedicated public servant with an enduring commitment to peace.",FALSE,1476,NA,2016-09-28 19:27:55,FALSE,NA,"781213868815183872",NA,"<a href=""http://twitter.com"" rel=""nofollow"">Twitter Web Client</a>","SenWarren",206,FALSE,FALSE,NA,NA
"517","As I said last week: Mr. Stumpf should resign, return every nickel he made while this scam was ongoing, &amp; face SEC &amp; DOJ investigations.",FALSE,4215,NA,2016-09-28 14:11:53,FALSE,NA,"781134339400609792",NA,"<a href=""http://twitter.com"" rel=""nofollow"">Twitter Web Client</a>","SenWarren",1232,FALSE,FALSE,NA,NA
"518",".@WellsFargo CEO Stumpf will be just fine: he keeps his job &amp; most of the money he made while massive fraud went on under his nose.",FALSE,1639,NA,2016-09-28 14:10:33,FALSE,NA,"781133999993262081",NA,"<a href=""http://twitter.com"" rel=""nofollow"">Twitter Web Client</a>","SenWarren",674,FALSE,FALSE,NA,NA
"519",".@WellsFargo employees who tried to sound the alarm about the creation of fake accounts were fired. Their lives turned upside down.",FALSE,1756,NA,2016-09-28 14:09:18,FALSE,NA,"781133686053871620",NA,"<a href=""http://twitter.com"" rel=""nofollow"">Twitter Web Client</a>","SenWarren",802,FALSE,FALSE,NA,NA
"520",".@WellsFargo employees who failed to meet management's outrageous sales goals were fired.",FALSE,831,NA,2016-09-28 14:08:10,FALSE,NA,"781133401663221761",NA,"<a href=""http://twitter.com"" rel=""nofollow"">Twitter Web Client</a>","SenWarren",293,FALSE,FALSE,NA,NA
"521","This is a small step in the right direction, but nowhere near real accountability. https://t.co/7Aj4fxXp9x",FALSE,994,NA,2016-09-28 14:06:59,FALSE,NA,"781133102466764800",NA,"<a href=""http://twitter.com"" rel=""nofollow"">Twitter Web Client</a>","SenWarren",402,FALSE,FALSE,NA,NA
"522","Watch my speech calling on @SenateGOP to end their outrageous demands &amp; to stop threatening a gov shutdown. https://t.co/FeX2lsYmvG",FALSE,1583,NA,2016-09-27 23:02:28,FALSE,NA,"780905477303590913",NA,"<a href=""http://twitter.com"" rel=""nofollow"">Twitter Web Client</a>","SenWarren",551,FALSE,FALSE,NA,NA
"523","And any politician who won't stand with Flint, MI - whose kids are choking on poisoned water - lacks the moral courage to serve in Congress.",FALSE,5400,NA,2016-09-27 23:01:01,FALSE,NA,"780905111145119744",NA,"<a href=""http://twitter.com"" rel=""nofollow"">Twitter Web Client</a>","SenWarren",2117,FALSE,FALSE,NA,NA
"524","If @SenateGOP seriously think they can hold the gov hostage to protect political corruption w/o anyone noticing, they'd better think again.",FALSE,2577,NA,2016-09-27 22:59:29,FALSE,NA,"780904722945417216",NA,"<a href=""http://twitter.com"" rel=""nofollow"">Twitter Web Client</a>","SenWarren",849,FALSE,FALSE,NA,NA
"525","Every agency w/ jurisdiction should follow @USDOL's lead &amp; determine whether @WellsFargo &amp; its senior execs should be prosecuted/sanctioned.",FALSE,1221,NA,2016-09-27 18:32:00,FALSE,NA,"780837409672003584",NA,"<a href=""http://twitter.com"" rel=""nofollow"">Twitter Web Client</a>","SenWarren",397,FALSE,FALSE,NA,NA
"526","I'm glad @USDOL announced today that it will conduct a prompt &amp; thorough ""top-to-bottom review"" of @WellsFargo. https://t.co/IJN1XVDmF6",FALSE,916,NA,2016-09-27 18:30:51,FALSE,NA,"780837122295074817",NA,"<a href=""http://twitter.com"" rel=""nofollow"">Twitter Web Client</a>","SenWarren",238,FALSE,FALSE,NA,NA
"527","Last week we asked @USDOL to investigate whether @WellsFargo violated the Fair Labor Standards Act. https://t.co/uLSbc4A4mX",FALSE,471,NA,2016-09-27 18:29:40,FALSE,NA,"780836823832653824",NA,"<a href=""http://twitter.com"" rel=""nofollow"">Twitter Web Client</a>","SenWarren",125,FALSE,FALSE,NA,NA
"528","We will not sit by while our planet is destroyed so that the super rich can make an extra buck.",FALSE,2407,NA,2016-09-27 16:40:34,FALSE,NA,"780809366396174336",NA,"<a href=""http://twitter.com"" rel=""nofollow"">Twitter Web Client</a>","SenWarren",698,FALSE,FALSE,NA,NA
"529","My @SenateDems colleagues issued a report showing how the fossil fuel industry funds Clean Power Plan opponents. https://t.co/b50fN7afnM",FALSE,651,NA,2016-09-27 16:39:04,FALSE,NA,"780808988946472960",NA,"<a href=""http://twitter.com"" rel=""nofollow"">Twitter Web Client</a>","SenWarren",263,FALSE,FALSE,NA,NA
"530","The fossil fuel industry made billions at the expense of our environment. Now they want to kill the country’s plan to reduce air toxins.",FALSE,1562,NA,2016-09-27 16:37:37,FALSE,NA,"780808626587992064",NA,"<a href=""http://twitter.com"" rel=""nofollow"">Twitter Web Client</a>","SenWarren",554,FALSE,FALSE,NA,NA
"531","Want to see 1 more example of the @GOP putting billionaires first? Just look at their opposition to the Clean Power Plan.",FALSE,1405,NA,2016-09-27 16:33:38,FALSE,NA,"780807621880213504",NA,"<a href=""http://twitter.com"" rel=""nofollow"">Twitter Web Client</a>","SenWarren",444,FALSE,FALSE,NA,NA
"532",".@WellsFargo’s Stumpf will be accountable only if he resigns, returns every nickel he got during the scam, &amp; faces DOJ &amp; SEC investigation.",FALSE,3024,NA,2016-09-26 16:52:06,FALSE,NA,"780449883706753026",NA,"<a href=""http://twitter.com"" rel=""nofollow"">Twitter Web Client</a>","SenWarren",862,FALSE,FALSE,NA,NA
"533","If John Stumpf can oversee a massive fraud &amp; walk away w/ $100M+, why should we expect any CEO to follow the law? https://t.co/wixnesLKGh",FALSE,2665,NA,2016-09-26 16:51:04,FALSE,NA,"780449622745608192",NA,"<a href=""http://twitter.com"" rel=""nofollow"">Twitter Web Client</a>","SenWarren",1426,FALSE,FALSE,NA,NA
"534","Yesterday I led a letter to @USDOL to investigate if @WellsFargo misclassified workers &amp; failed to pay overtime: https://t.co/JdsIupLhmQ",FALSE,957,NA,2016-09-23 15:10:44,FALSE,NA,"779337208285237248",NA,"<a href=""http://twitter.com"" rel=""nofollow"">Twitter Web Client</a>","SenWarren",269,FALSE,FALSE,NA,NA
"535","The @CFPB’s investigation of @WellsFargo uncovered staggering workplace conditions imposed on employees to meet sales quotas.",FALSE,1042,NA,2016-09-23 15:09:44,FALSE,NA,"779336957713342465",NA,"<a href=""http://twitter.com"" rel=""nofollow"">Twitter Web Client</a>","SenWarren",370,FALSE,FALSE,NA,NA
"536",".@WellsFargo CEO John Stumpf blamed his bank’s massive fraud on 5300 low-level bank tellers, branch managers &amp; customer service reps.",FALSE,1403,NA,2016-09-23 15:08:51,FALSE,NA,"779336732349231104",NA,"<a href=""http://twitter.com"" rel=""nofollow"">Twitter Web Client</a>","SenWarren",591,FALSE,FALSE,NA,NA
"537","Congress must do more to reform higher ed accreditation, so I introduced a bill w/ @SenatorDurbin &amp; @SenBrianSchatz: https://t.co/33bV95cRNF",FALSE,740,NA,2016-09-22 22:22:51,FALSE,NA,"779083564944125954",NA,"<a href=""http://twitter.com"" rel=""nofollow"">Twitter Web Client</a>","SenWarren",238,FALSE,FALSE,NA,NA
"538",".@usedgov did the right thing today to protect students &amp; taxpayers by stripping ACICS of its college accreditation power.",FALSE,1273,NA,2016-09-22 22:21:17,FALSE,NA,"779083172906688517",NA,"<a href=""http://twitter.com"" rel=""nofollow"">Twitter Web Client</a>","SenWarren",360,FALSE,FALSE,NA,NA
"539","Corinthian &amp; ITT Tech committed fraud to drown students in debt with useless degrees, but ACICS accredited both when they filed bankruptcy.",FALSE,1293,NA,2016-09-22 22:20:08,FALSE,NA,"779082883692654593",NA,"<a href=""http://twitter.com"" rel=""nofollow"">Twitter Web Client</a>","SenWarren",506,FALSE,FALSE,NA,NA
"540","College accreditation is supposed to make sure kids get a good education while colleges take taxpayer money. But the system is broken.",FALSE,1568,NA,2016-09-22 22:19:02,FALSE,NA,"779082603773194244",NA,"<a href=""http://twitter.com"" rel=""nofollow"">Twitter Web Client</a>","SenWarren",448,FALSE,FALSE,NA,NA
"541",".@SenateGOP has billions of reasons to defend this rotten system - but we're sick of it &amp; ready to fight. https://t.co/acTsbKkKU4",FALSE,1149,NA,2016-09-21 15:51:23,FALSE,NA,"778622663178715140",NA,"<a href=""http://twitter.com/download/iphone"" rel=""nofollow"">Twitter for iPhone</a>","SenWarren",501,FALSE,FALSE,NA,NA
"542",".@realDonaldTrump won't release his taxes voluntarily. Let's pass the Presidential Tax Transparency Act and make sure he comes clean.",FALSE,5683,NA,2016-09-15 21:10:01,FALSE,NA,"776528520315101185",NA,"<a href=""http://twitter.com"" rel=""nofollow"">Twitter Web Client</a>","SenWarren",2827,FALSE,FALSE,NA,NA
"543","We don't know what @realDonaldTrump is hiding in his taxes. What new tax scams he's running. Which foreign dictators have him on the take.",FALSE,3947,NA,2016-09-15 21:09:01,FALSE,NA,"776528269399162880",NA,"<a href=""http://twitter.com"" rel=""nofollow"">Twitter Web Client</a>","SenWarren",2047,FALSE,FALSE,NA,NA
"544","Every major party Presidential candidate should release their tax returns. And they all do – except @realDonaldTrump. He's just too chicken.",FALSE,4919,NA,2016-09-15 21:07:16,FALSE,NA,"776527829441839105",NA,"<a href=""http://twitter.com"" rel=""nofollow"">Twitter Web Client</a>","SenWarren",2135,FALSE,FALSE,NA,NA
"545","Thanks, FCIC Chair @PhilAngelides. I agree: This wasn't ""immaculate corruption"" - DOJ's failure defies common sense. https://t.co/W9MOrTjfWw",FALSE,458,NA,2016-09-15 18:07:52,FALSE,NA,"776482680720457728",NA,"<a href=""http://twitter.com"" rel=""nofollow"">Twitter Web Client</a>","SenWarren",201,FALSE,FALSE,NA,NA
"546","The @FBI released @HillaryClinton’s info citing “intense public interest.” It should do the same for its Wall Street FCIC investigations.",FALSE,2123,NA,2016-09-15 14:39:12,FALSE,NA,"776430171628986368",NA,"<a href=""http://twitter.com"" rel=""nofollow"">Twitter Web Client</a>","SenWarren",877,FALSE,FALSE,NA,NA
"547","I’ve also asked the @FBI to release its investigation materials related to FCIC referrals. https://t.co/iicSLZ2Wwf https://t.co/rvt4JF8frd",FALSE,866,NA,2016-09-15 14:37:01,FALSE,NA,"776429621902512128",NA,"<a href=""http://twitter.com"" rel=""nofollow"">Twitter Web Client</a>","SenWarren",351,FALSE,FALSE,NA,NA
"548","I've asked @TheJusticeDept to investigate its inability to prosecute the FCIC's referrals. https://t.co/iicSLZ2Wwf https://t.co/oVNl7ghEx3",FALSE,700,NA,2016-09-15 14:35:41,FALSE,NA,"776429285146066944",NA,"<a href=""http://twitter.com"" rel=""nofollow"">Twitter Web Client</a>","SenWarren",260,FALSE,FALSE,NA,NA
"549","Not one of the people or corporations referred to @TheJusticeDept by the FCIC has been criminally prosecuted. That’s an abysmal failure.",FALSE,1180,NA,2016-09-15 14:32:54,FALSE,NA,"776428583694786560",NA,"<a href=""http://twitter.com"" rel=""nofollow"">Twitter Web Client</a>","SenWarren",459,FALSE,FALSE,NA,NA
"550","The FCIC investigated the causes of the 2008 crisis. Recently-released docs show they referred 9 people &amp; 14 corps to @TheJusticeDept.",FALSE,587,NA,2016-09-15 14:31:55,FALSE,NA,"776428335492657152",NA,"<a href=""http://twitter.com"" rel=""nofollow"">Twitter Web Client</a>","SenWarren",249,FALSE,FALSE,NA,NA
"551","8 years ago today, Lehman Bros filed for bankruptcy. The big banks recklessly gambled with our economy &amp; millions of people suffered for it.",FALSE,1868,NA,2016-09-15 14:31:00,FALSE,NA,"776428106420715520",NA,"<a href=""http://twitter.com"" rel=""nofollow"">Twitter Web Client</a>","SenWarren",839,FALSE,FALSE,NA,NA
"552","Rep @LamarSmithTX21’s big oil buddies don’t want state AGs to do their jobs, but the AGs aren’t going to cower to big oil or the GOP.",FALSE,762,NA,2016-09-14 20:47:49,FALSE,NA,"776160548337623040",NA,"<a href=""http://twitter.com"" rel=""nofollow"">Twitter Web Client</a>","SenWarren",266,FALSE,FALSE,NA,NA
"553","You don’t need a hearing to know basic facts, @LamarSmithTX21: the US Constitution gives states power to enforce state laws.",FALSE,669,NA,2016-09-14 20:46:37,FALSE,NA,"776160244674260992",NA,"<a href=""http://twitter.com"" rel=""nofollow"">Twitter Web Client</a>","SenWarren",155,FALSE,FALSE,NA,NA
